don, diesels, people, fuel, cars
station, option, shuttle, launch, redesign
insurance, good, geico, questions, blah
henry, spencer, toronto, zoo, svr
space, nasa, long, such, gov
sky, point, light, people, power
etc, day, earth, time, another
mission, hst, solar, shuttle, pat
edu, writes, article, mustang, don
engine, turbo, quite, body, reason
make, want, book, cost, saturn
bill, moon, back, george, called
article, apr, engines, writes, eliot
cars, price, seat, problem, rear
don, clutch, car, shifter, sho
oil, service, come, lights, change
writes, system, oort, edu, ray
car, ford, driving, speed, even
edu, gif, uci, ics, incoming
science, part, information, internet, mars
